title,authors,year,description,url,citations,cluster,type,clean_title,word_count,char_count,category,domain,publisher,path,query_params,doi,extension
nutrition cardiovascular health,"R Casas, S Castro",2018.0,"Cardiovascular disease (CVD) is the leading cause of death in Western countries, representing 
almost 30% of all deaths worldwide. Evidence shows the effectiveness of healthy dietary …",https://www.mdpi.com/1422-0067/19/12/3988,397,9,,Nutrition and cardiovascular health,4,32,nutrition,mdpi.com,MDPI (Multidisciplinary Digital Publishing Institute),/1422-0067/19/12/3988,{},,
effect climate change across food systems implications nutrition outcomes,"J Fanzo, C Davis, R McLaren, J Choufani",2018.0,"… nutrition-sensitive food system in order to ensure that mitigation and adaptation strategies 
take nutrition … and nutrition but they need to be implemented and scaled by governments. …",https://www.sciencedirect.com/science/article/pii/S2211912418300063,385,2,,The effect of climate change across food systems: Implications for nutrition outcomes,12,74,nutrition,sciencedirect.com,ScienceDirect (Elsevier),/science/article/pii/S2211912418300063,{},,
htmlhtml metaanalysis association production diversity diets nutrition smallholder farm households,"KT Sibhatu, M Qaim",2018.0,"… nutrition, but the evidence is mixed. We systematically review studies that have analyzed 
associations between production diversity, dietary diversity, and nutrition … of diets and nutrition. …",https://www.sciencedirect.com/science/article/pii/S0306919217309016,366,3,HTML,"Meta-analysis of the association between production diversity, diets, and nutrition in smallholder farm households",14,101,nutrition,sciencedirect.com,ScienceDirect (Elsevier),/science/article/pii/S0306919217309016,{},,
frontofpackage nutrition labelling policy global progress future directions,"R Kanter, L Vanderlee, S Vandevijvere",2018.0,"… (FOP) nutrition labelling systems. FOP nutrition labels encompass a specific element of 
nutrition labelling postulated to allow for quick decision making about the nutritional content or …",https://www.cambridge.org/core/journals/public-health-nutrition/article/frontofpackage-nutrition-labelling-policy-global-progress-and-future-directions/E24D6BBF326D3D78BFF28779457F5D6D,364,3,,Front-of-package nutrition labelling policy: global progress and future directions,9,74,nutrition,cambridge.org,Cambridge University Press,/core/journals/public-health-nutrition/article/frontofpackage-nutrition-labelling-policy-global-progress-and-future-directions/E24D6BBF326D3D78BFF28779457F5D6D,{},,
htmlhtml biomarkers nutrition development bondiron review,"S Lynch, CM Pfeiffer, MK Georgieff, G Brittenham",2018.0,"This is the fifth in the series of reviews developed as part of the Biomarkers of Nutrition for 
Development (BOND) program. The BOND Iron Expert Panel (I-EP) reviewed the extant …",https://www.sciencedirect.com/science/article/pii/S0022316622164102,356,0,HTML,Biomarkers of Nutrition for Development (BOND)—iron review,7,52,nutrition,sciencedirect.com,ScienceDirect (Elsevier),/science/article/pii/S0022316622164102,{},,
phytobiotics poultry swine nutritiona review,"M Mohammadi Gheisar, IH Kim",2018.0,"The trend in the use of phytobiotics in animal feed has been increased during last two decades. 
Investigations showed that excessive use of in-feed antibiotics will intensify the potential …",https://www.tandfonline.com/doi/abs/10.1080/1828051X.2017.1350120,345,0,,Phytobiotics in poultry and swine nutrition–a review,7,46,nutrition,tandfonline.com,Taylor & Francis Online,/doi/abs/10.1080/1828051X.2017.1350120,{},10.1080/1828051,1350120
applications αlactalbumin human nutrition,"DK Layman, B Lönnerdal, JD Fernstrom",2018.0,"… of which are crucial for infant nutrition. α-Lactalbumin contributes … It also has potential as a 
nutritional supplement to support … may have usefulness in nutritional supplements include the …",https://academic.oup.com/nutritionreviews/article-abstract/76/6/444/4956472,338,3,,Applications for α-lactalbumin in human nutrition,6,44,nutrition,academic.oup.com,Oxford University Press,/nutritionreviews/article-abstract/76/6/444/4956472,{},,
diabetes uk evidencebased nutrition guidelines prevention management diabetes,"PA Dyson, D Twenefour, C Breen, A Duncan",2018.0,"A summary of the latest evidence‐based nutrition guidelines for the prevention and management 
of diabetes is presented. These guidelines are based on existing recommendations …",https://onlinelibrary.wiley.com/doi/abs/10.1111/dme.13603,322,3,,Diabetes UK evidence‐based nutrition guidelines for the prevention and management of diabetes,12,82,nutrition,onlinelibrary.wiley.com,Wiley Online Library,/doi/abs/10.1111/dme.13603,{},,13603
use social media nutrition interventions adolescents young adultsa systematic review,"MM Chau, M Burgermaster, L Mamykina",2018.0,"… adults in maintaining healthy diets and learning about nutrition. This review identifies 
interventions that use social media to promote nutrition, examines their content and features, and …",https://www.sciencedirect.com/science/article/pii/S138650561830039X,310,4,,The use of social media in nutrition interventions for adolescents and young adults—A systematic review,15,89,nutrition,sciencedirect.com,ScienceDirect (Elsevier),/science/article/pii/S138650561830039X,{},,
htmlhtml biomarkers nutrition development bond vitamin b12 review,"LH Allen, JW Miller, L De Groot, IH Rosenberg",2018.0,"This report on vitamin B-12 (B12) is part of the Biomarkers of Nutrition for Development (BOND) 
Project, which provides state-of-the art information and advice on the selection, use, and …",https://www.sciencedirect.com/science/article/pii/S0022316622164266,303,0,HTML,Biomarkers of Nutrition for Development (BOND): vitamin B-12 review,9,59,nutrition,sciencedirect.com,ScienceDirect (Elsevier),/science/article/pii/S0022316622164266,{},,
espghanespenesprcspen guidelines pediatric parenteral nutrition lipids,"A Lapillonne, NF Mis, O Goulet",2018.0,"1. Methods Literature search timeframe: The references cited in the previous guidelines [1] 
are not repeated here, except for some relevant publications, and only the previous …",https://www.clinicalnutritionjournal.com/article/S0261-5614(18)31165-8/abstract,294,3,,ESPGHAN/ESPEN/ESPR/CSPEN guidelines on pediatric parenteral nutrition: Lipids,7,71,nutrition,clinicalnutritionjournal.com,ESPEN (European Society for Clinical Nutrition),/article/S0261-5614(18)31165-8/abstract,{},,
heartrate variability biomarker study influence nutrition physiological psychological health,"HA Young, D Benton",2018.0,"As the influence of diet on health may take place over a period of decades, there is a need 
for biomarkers that help to identify those aspects of nutrition that have either a positive or a …",https://journals.lww.com/behaviouralpharm/fulltext/2018/04000/Heart_rate_variability__a_biomarker_to_study_the.5.aspx,293,9,,Heart-rate variability: a biomarker to study the influence of nutrition on physiological and psychological health?,15,100,nutrition,journals.lww.com,Lippincott Williams & Wilkins,/behaviouralpharm/fulltext/2018/04000/Heart_rate_variability__a_biomarker_to_study_the.5.aspx,{},,aspx
nutrition therapy,"JL Sievenpiper, CB Chan, PD Dworatzek",2018.0,"… The goals of nutrition therapy are to maintain or improve quality of life and nutritional and 
physiological health; and to prevent and treat acute-and long-term complications of diabetes, …",https://www.sciencedirect.com/science/article/pii/S1499267117308195,279,3,,Nutrition therapy,2,16,nutrition,sciencedirect.com,ScienceDirect (Elsevier),/science/article/pii/S1499267117308195,{},,
enteral nutrition maintenance remission crohns disease,"AK Akobeng, D Zhang, M Gordon",2018.0,"… Enteral nutrition is a form of nutritional therapy for Crohn's disease patients. The mechanism 
… nutrition may influence inflammation is unknown and is being studied. Enteral nutrition can …",https://www.cochranelibrary.com/cdsr/doi/10.1002/14651858.CD005984.pub3/abstract,260,3,,Enteral nutrition for maintenance of remission in Crohn's disease,9,57,nutrition,cochranelibrary.com,Cochrane Library,/cdsr/doi/10.1002/14651858.CD005984.pub3/abstract,{},10.1002/14651858,
zinc nutrition wheatbased cropping systems,"A Rehman, M Farooq, L Ozturk, M Asif, KHM Siddique",2018.0,"… Agronomic, breeding and molecular approaches to improve Zn nutrition and biofortification 
of … Effect of Zn nutrition on salt stress tolerance of 30-day-old wheat plants (T. aestivum L. cv. …",https://link.springer.com/article/10.1007/s11104-017-3507-3,253,3,,Zinc nutrition in wheat-based cropping systems,6,41,nutrition,link.springer.com,Springer,/article/10.1007/s11104-017-3507-3,{},10.1007/s11104,
htmlhtml microbial enterotypes personalized nutrition obesity management,"L Christensen, HM Roager, A Astrup",2018.0,"… Human gut microbiota has been suggested to play an important role in nutrition and … a 
nutritional context and discuss how enterotype stratification may be used in personalized nutrition …",https://www.sciencedirect.com/science/article/pii/S0002916522029951,196,9,HTML,Microbial enterotypes in personalized nutrition and obesity management,8,63,nutrition,sciencedirect.com,ScienceDirect (Elsevier),/science/article/pii/S0002916522029951,{},,
pdfpdf australian sugarcane nutrition manual,"D Calcino, B Schroeder, J Panitz, A Hurney",2018.0,"… The manual is designed to be a practical guide and reference on most aspects of 
sugarcane nutrition. At the end of several chapters, a short summary highlights the major …",https://elibrary.sugarresearch.com.au/bitstream/handle/11079/17260/Australian%20Sugarcane%20Nutrition%20Manual.pdf?sequence=1,175,3,PDF,Australian sugarcane nutrition manual,4,34,nutrition,elibrary.sugarresearch.com.au,Sugar Research Australia,/bitstream/handle/11079/17260/Australian%20Sugarcane%20Nutrition%20Manual.pdf,{'sequence': ['1']},,pdf
challenges personalized nutrition health,"M Verma, R Hontecillas, N Tubau",2018.0,"Personalized nutrition refers to tailored nutritional … individual, the goal of personalized nutrition 
is to promote the health and … The absence of balanced food and nutrition security leads to …",https://www.frontiersin.org/articles/10.3389/fnut.2018.00117/full,127,9,,Challenges in personalized nutrition and health,6,42,nutrition,frontiersin.org,Frontiers,/articles/10.3389/fnut.2018.00117/full,{},,
bookb advanced human nutrition,"DM Medeiros, REC Wildman",2018.0,"… Originally, nutritional research was conducted by men and women simply for the love of 
science. Later, during the 1940s, the federal government took a more active role in scientific …",https://books.google.com/books?hl=en&lr=&id=Y5hIDwAAQBAJ&oi=fnd&pg=PP1&dq=nutrition&ots=TGngSLMJE1&sig=2zAXNugxGqGzJhwdIxxa74KrUlA,111,8,BOOK,Advanced human nutrition,3,22,nutrition,books.google.com,Google Books,/books,"{'hl': ['en'], 'id': ['Y5hIDwAAQBAJ'], 'oi': ['fnd'], 'pg': ['PP1'], 'dq': ['nutrition'], 'ots': ['TGngSLMJE1'], 'sig': ['2zAXNugxGqGzJhwdIxxa74KrUlA']}",,
position academy nutrition dietetics benchmarks nutrition child care,SE Benjamin,2018.0,"… recommendations for nutrition in ECE and provides guidance for registered dietitian nutritionists; 
nutrition and dietetics technicians, registered; and other food and nutrition practitioners …",https://www.sciencedirect.com/science/article/pii/S2212267218306695,109,3,,Position of the Academy of Nutrition and Dietetics: Benchmarks for nutrition in child care,14,77,nutrition,sciencedirect.com,ScienceDirect (Elsevier),/science/article/pii/S2212267218306695,{},,
academy nutrition dietetics society nutrition education behavior school nutrition association comprehensive nutrition programs services,"D Hayes, IR Contento, C Weekly",2018.0,"… nutrition programs in preschool through high school are essential to improve the health, 
nutritional status… Updated nutrition standards are providing students with a wider variety of fruits, …",https://www.sciencedirect.com/science/article/pii/S1499404618301416,101,3,,"… the Academy of Nutrition and Dietetics, Society for Nutrition Education and Behavior, and School Nutrition Association: comprehensive nutrition programs and services …",23,149,nutrition,sciencedirect.com,ScienceDirect (Elsevier),/science/article/pii/S1499404618301416,{},,
pdfpdf application organic acids poultry nutrition,H Hajati,2018.0,"… Organic acids have gained significant attention due to their high nutritional value and … 
the purpose of this paper is to review the potential of using organic acids in poultry nutrition. …",https://www.researchgate.net/profile/Hosna-Hajati/publication/328068674_Application_of_organic_acids_in_poultry_nutrition/links/5e5d2c664585152ce800619e/Application-of-organic-acids-in-poultry-nutrition.pdf,97,3,PDF,Application of organic acids in poultry nutrition,7,43,nutrition,researchgate.net,ResearchGate,/profile/Hosna-Hajati/publication/328068674_Application_of_organic_acids_in_poultry_nutrition/links/5e5d2c664585152ce800619e/Application-of-organic-acids-in-poultry-nutrition.pdf,{},,pdf
nutrition management head neck cancer patient,"D Ackerman, M Laszlo, A Provisor, A Yu",2018.0,"… intake either orally or through nutrition support therapy in order to … This chapter will discuss 
nutrition interventions to manage … enteral nutrition or less commonly, parenteral nutrition. …",https://link.springer.com/chapter/10.1007/978-3-319-65421-8_11,96,5,,Nutrition management for the head and neck cancer patient,9,49,nutrition,link.springer.com,Springer,/chapter/10.1007/978-3-319-65421-8_11,{},10.1007/978,
htmlhtml perspective reductionist nutrition research meaning within framework holistic ethical thinking,"A Fardet, E Rock",2018.0,"… the reductionist paradigm applied to nutrition research for more … for more holistic approaches 
in nutrition to preserve our health, … public and to simplify nutritional messages, we propose 3 …",https://www.sciencedirect.com/science/article/pii/S2161831322012625,85,3,HTML,Perspective: reductionist nutrition research has meaning only within the framework of holistic and ethical thinking,15,101,nutrition,sciencedirect.com,ScienceDirect (Elsevier),/science/article/pii/S2161831322012625,{},,
plant nanonutrition perspectives challenges,H El,2018.0,"… Here we review the plant nano-nutrition including the response of plants and soils to … in 
shape, texture, color, taste and nutritional aspects on nanonutrients exposed plants as a major …",https://link.springer.com/chapter/10.1007/978-3-319-70166-0_4,78,9,,Plant nano-nutrition: perspectives and challenges,5,45,nutrition,link.springer.com,Springer,/chapter/10.1007/978-3-319-70166-0_4,{},10.1007/978,
nutrition review possible treatment alzheimers disease,"BOA Botchway, MK Moore, FO Akinleye",2018.0,"… Nutrition has and continues to play a salient role in the survival of living organisms with no 
exception for human beings. Herein, we report the connection between nutrition … nutritional …",https://content.iospress.com/articles/journal-of-alzheimers-disease/jad170874,55,0,,Nutrition: Review on the possible treatment for Alzheimer's disease,9,59,nutrition,content.iospress.com,IOS Press,/articles/journal-of-alzheimers-disease/jad170874,{},,
finance uncertainty multiplier,"I Alfaro, N Bloom, X Lin",2024.0,"We show how real and financial frictions amplify, prolong, and propagate the negative impact 
of uncertainty shocks. We use a novel instrumentation strategy to address endogeneity in …",https://www.journals.uchicago.edu/doi/full/10.1086/726230,407,0,,The finance uncertainty multiplier,4,31,finance,journals.uchicago.edu,University of Chicago Press,/doi/full/10.1086/726230,{},10.1086/726230,
bookb finance local government,NP Hepworth,2024.0,"Originally published in 1970 this book quickly became a classic textbook. This edition reissues 
the 7th edition of 1984. An indispensable text for students, local government employees …",https://books.google.com/books?hl=en&lr=&id=kFczEQAAQBAJ&oi=fnd&pg=PP1&dq=finance&ots=AHDqaBlLLT&sig=OshgXxGNoT2KTGKJcmHCrz8SnCU,176,0,BOOK,The finance of local government,5,27,finance,books.google.com,Google Books,/books,"{'hl': ['en'], 'id': ['kFczEQAAQBAJ'], 'oi': ['fnd'], 'pg': ['PP1'], 'dq': ['finance'], 'ots': ['AHDqaBlLLT'], 'sig': ['OshgXxGNoT2KTGKJcmHCrz8SnCU']}",,
bookb mathematics economics finance methods modelling,"M Anthony, N Biggs",2024.0,"Accessible, concise, and interactive, this book introduces the mathematical methods that are 
indispensable in economics and finance. Fully updated to be as student friendly as possible…",https://books.google.com/books?hl=en&lr=&id=xWAJEQAAQBAJ&oi=fnd&pg=PA1&dq=finance&ots=vam_WaipXt&sig=tDPz-tLnm-sd4j_EeXEpEhx0eHg,95,0,BOOK,Mathematics for economics and finance: methods and modelling,8,53,finance,books.google.com,Google Books,/books,"{'hl': ['en'], 'id': ['xWAJEQAAQBAJ'], 'oi': ['fnd'], 'pg': ['PA1'], 'dq': ['finance'], 'ots': ['vam_WaipXt'], 'sig': ['tDPz-tLnm-sd4j_EeXEpEhx0eHg']}",,
technology decentralized finance defi,"R Auer, B Haslhofer, S Kitzler, P Saggese, F Victor",2024.0,"Decentralized Finance (DeFi) is a new financial paradigm that leverages distributed ledger 
technologies to offer services such as lending, investing, or exchanging cryptoassets without …",https://link.springer.com/article/10.1007/s42521-023-00088-8,91,3,,The technology of decentralized finance (DeFi),6,41,finance,link.springer.com,Springer,/article/10.1007/s42521-023-00088-8,{},10.1007/s42521,
bookb personal finance,VL Bajtelsmit,2024.0,"Personal Finance, 3rd Edition offers essential skills and knowledge that will set students on 
the road to lifelong financial wellness. Byfocusing on real-world decision making, Bajtelsmit …",https://books.google.com/books?hl=en&lr=&id=SNjzEAAAQBAJ&oi=fnd&pg=PA4&dq=finance&ots=eIpdOqYZkQ&sig=BM--bAJ9ifrK-j__04ZZlU4rijk,36,7,BOOK,Personal finance,2,15,finance,books.google.com,Google Books,/books,"{'hl': ['en'], 'id': ['SNjzEAAAQBAJ'], 'oi': ['fnd'], 'pg': ['PA4'], 'dq': ['finance'], 'ots': ['eIpdOqYZkQ'], 'sig': ['BM--bAJ9ifrK-j__04ZZlU4rijk']}",,
sustainable finance research review agenda,"M Singhania, G Chadha",2024.0,"… finance to prevent greenwashing, the impact of climate change and climate finance on 
sustainable finance… renewable energy finance, SDG finance, social finance, transition finance and …",https://onlinelibrary.wiley.com/doi/abs/10.1002/ijfe.2854,27,4,,Sustainable finance research: review and agenda,6,42,finance,onlinelibrary.wiley.com,Wiley Online Library,/doi/abs/10.1002/ijfe.2854,{},,2854
htmlhtml scoping review chatgpt research accounting finance,"MM Dong, TC Stratopoulos, VX Wang",2024.0,"This paper provides a review of recent publications and working papers on ChatGPT and 
related Large Language Models (LLMs) in accounting and finance. The aim is to understand …",https://www.sciencedirect.com/science/article/pii/S1467089524000484,23,4,HTML,A scoping review of ChatGPT research in accounting and finance,10,53,finance,sciencedirect.com,ScienceDirect (Elsevier),/science/article/pii/S1467089524000484,{},,
forensic finance,"JM Griffin, S Kruger",2024.0,"… a financial nature or related finance. We define the field of forensic finance as the examination 
of … , and the term forensic finance does not have a settled definition. Investigative forensic …",https://www.nowpublishers.com/article/Details/FIN-073,19,0,,What is forensic finance?,4,22,finance,nowpublishers.com,Now Publishers,/article/Details/FIN-073,{},,
digital finance shapes residents health evidence china,"L Liao, M Du",2024.0,"… finance affects residents' overall and mental health. Findings show that increasing digital 
finance is … The possible channels through which digital finance plays a critical role in enhancing …",https://www.sciencedirect.com/science/article/pii/S1043951X24001354,18,2,,How digital finance shapes residents' health: evidence from China,9,57,finance,sciencedirect.com,ScienceDirect (Elsevier),/science/article/pii/S1043951X24001354,{},,
bookb fundamentals corporate finance,"RA Brealey, SC Myers, AJ Marcus",2023.0,"This book is an introduction to corporate finance focusing on how companies invest in real 
assets, how they raise the money to pay for the investments, and how those assets ultimately …",https://thuvienso.hoasen.edu.vn/handle/123456789/13075,2830,8,BOOK,Fundamentals of corporate finance,4,30,finance,thuvienso.hoasen.edu.vn,Hoa Sen University Digital Library,/handle/123456789/13075,{},,
bookb project finance theory practice designing structuring financing private public projects,S Gatti,2023.0,"… finance experts who share their specialized knowledge on legal issues and the role of advisors 
in project finance … to learn how to succeed in project finance. Features useful, illustrative …",https://books.google.com/books?hl=en&lr=&id=CJqhEAAAQBAJ&oi=fnd&pg=PP1&dq=finance&ots=CnAebHG2Jx&sig=h1wqymm-72shCLe4cZZm71qYm40,909,0,BOOK,"Project finance in theory and practice: designing, structuring, and financing private and public projects",14,92,finance,books.google.com,Google Books,/books,"{'hl': ['en'], 'id': ['CJqhEAAAQBAJ'], 'oi': ['fnd'], 'pg': ['PP1'], 'dq': ['finance'], 'ots': ['CnAebHG2Jx'], 'sig': ['h1wqymm-72shCLe4cZZm71qYm40']}",,
bloomberggpt large language model finance,"S Wu, O Irsoy, S Lu, V Dabravolski, M Dredze",2023.0,"… The finance-specific tasks help us test our hypothesis that training on high-quality finance-specific 
data will … In sum, according to this benchmark, we find that developing financespecific …",https://arxiv.org/abs/2303.17564,908,0,,Bloomberggpt: A large language model for finance,7,42,finance,arxiv.org,arXiv,/abs/2303.17564,{},,17564
bookb international finance,K Pilbeam,2023.0,"… (NFTs) and the application of blockchain to areas of finance is undoubtedly increasing. It is 
a fast-developing space that will undoubtedly affect the world of finance in the years to come, …",https://books.google.com/books?hl=en&lr=&id=nT6sEAAAQBAJ&oi=fnd&pg=PP1&dq=finance&ots=ueobe6DCzY&sig=9JLhnDVW6JZuP-NtI354y1B5PRc,787,9,BOOK,International finance,2,20,finance,books.google.com,Google Books,/books,"{'hl': ['en'], 'id': ['nT6sEAAAQBAJ'], 'oi': ['fnd'], 'pg': ['PP1'], 'dq': ['finance'], 'ots': ['ueobe6DCzY'], 'sig': ['9JLhnDVW6JZuP-NtI354y1B5PRc']}",,
htmlhtml chatgpt finance research bananarama conjecture,"M Dowling, B Lucey",2023.0,"… We show, based on ratings by finance journal reviewers of generated output, that the 
recently released AI chatbot ChatGPT can significantly assist with finance research. In principle, …",https://www.sciencedirect.com/science/article/pii/S1544612323000363,586,4,HTML,ChatGPT for (finance) research: The Bananarama conjecture,7,51,finance,sciencedirect.com,ScienceDirect (Elsevier),/science/article/pii/S1544612323000363,{},,
replication crisis finance,"TI Jensen, B Kelly, LH Pedersen",2023.0,"… Our findings have broad implications for finance researchers and practitioners. We confirm 
that the body of finance research contains a multitude of replicable information about the …",https://onlinelibrary.wiley.com/doi/abs/10.1111/jofi.13249,447,0,,Is there a replication crisis in finance?,7,35,finance,onlinelibrary.wiley.com,Wiley Online Library,/doi/abs/10.1111/jofi.13249,{},,13249
bookb information choice macroeconomics finance,L Veldkamp,2023.0,"… This book examines macroeconomics and finance models … appear all over economics and 
finance, how people evaluate these … corners of macroeconomics and finance, I hope this book …",https://books.google.com/books?hl=en&lr=&id=qlSIEAAAQBAJ&oi=fnd&pg=PP9&dq=finance&ots=DNwKDdVBIN&sig=hTtx1dhSgRnoweIql4iufrcNhkI,434,0,BOOK,Information choice in macroeconomics and finance,6,43,finance,books.google.com,Google Books,/books,"{'hl': ['en'], 'id': ['qlSIEAAAQBAJ'], 'oi': ['fnd'], 'pg': ['PP9'], 'dq': ['finance'], 'ots': ['DNwKDdVBIN'], 'sig': ['hTtx1dhSgRnoweIql4iufrcNhkI']}",,
bookb essentials health care finance,"WO Cleverley, JO Cleverley, AV Parks",2023.0,"Blending the topics of both accounting and finance, Essentials of Health Care Finance is a 
relevant, readable, and easily applied resource for health care management students and …",https://books.google.com/books?hl=en&lr=&id=CI7hEAAAQBAJ&oi=fnd&pg=PP1&dq=finance&ots=GLtdlP81TZ&sig=1wCpc9c95c1Wj7C2KcochMjB_XQ,411,0,BOOK,Essentials of health care finance,5,29,finance,books.google.com,Google Books,/books,"{'hl': ['en'], 'id': ['CI7hEAAAQBAJ'], 'oi': ['fnd'], 'pg': ['PP1'], 'dq': ['finance'], 'ots': ['GLtdlP81TZ'], 'sig': ['1wCpc9c95c1Wj7C2KcochMjB_XQ']}",,
presidential address sustainable finance esg issuesvalue versus values,LT Starks,2023.0,"In this address, I discuss differences across investor and manager motivations for considering 
sustainable finance—value versus values motivations—and how these differences …",https://onlinelibrary.wiley.com/doi/abs/10.1111/jofi.13255,213,4,,Presidential Address: Sustainable Finance and ESG Issues—Value versus Values,9,68,finance,onlinelibrary.wiley.com,Wiley Online Library,/doi/abs/10.1111/jofi.13255,{},,13255
bookb nigerian federal finance developments problems prospects,A Adedeji,2023.0,"… 1958-62, is more concerned with the broad issues of public finance than with the specific 
problems of federal finance. And, as this book shows, the problems of federal finance in Nigeria …",https://www.taylorfrancis.com/books/mono/10.4324/9781003451419/nigerian-federal-finance-adebayo-adedeji,182,0,BOOK,"Nigerian Federal Finance: Its Developments, Problems and Prospects",8,59,finance,taylorfrancis.com,Taylor & Francis,/books/mono/10.4324/9781003451419/nigerian-federal-finance-adebayo-adedeji,{},10.4324/9781003451419/,
