title,authors,year,description,url,citations,cluster,type,clean_title,word_count,char_count,category,domain,publisher,path,query_params,doi,extension
effect renewable nuclear energy consumption decoupling economic growth co2 emissions spain,"M Piłatowska, A Geise, A Włodarczyk",2020.0,"… Our analysis reveals that economic growth and CO 2 emissions … economic growth, but 
unidirectional positive causality running from renewable energy consumption to economic growth …",https://www.mdpi.com/1996-1073/13/9/2124,110,6,,The Effect of Renewable and Nuclear Energy Consumption on Decoupling Economic Growth from CO2 Emissions in Spain,17,96,economic growth,mdpi.com,MDPI (Multidisciplinary Digital Publishing Institute),/1996-1073/13/9/2124,{},,
institutional quality economic growth panel ardl analysis selected developing economies asia,"N Asghar, DS Qureshi, M Nadeem",2020.0,"… institutional quality has positive impact on economic growth. The results of panel causality … 
quality to economic growth. The study stresses that for increasing economic growth there is a …",https://journals.pu.edu.pk/journals/index.php/IJSAS/article/view/3028,108,5,,Institutional quality and economic growth: Panel ARDL analysis for selected developing economies of Asia,14,91,economic growth,journals.pu.edu.pk,University of the Punjab,/journals/index.php/IJSAS/article/view/3028,{},,
environmental taxes reforms economic growth empirical analysis panel data,"M Hassan, W Oueslati, D Rousselière",2020.0,"… related tax revenues and the economic growth rate, we built a complete empirical growth 
model that controls the main drivers of economic growth according to the empirical and …",https://www.sciencedirect.com/science/article/pii/S093936251830400X,108,8,,"Environmental taxes, reforms and economic growth: an empirical analysis of panel data",12,74,economic growth,sciencedirect.com,ScienceDirect (Elsevier),/science/article/pii/S093936251830400X,{},,
examining linkages electricity consumption economic growth african economies,"AI Lawal, I Ozturk, IO Olanipekun, AJ Asaleye",2020.0,"… economic activities, increasing industrialization and urbanization. This connection between 
economic growth and electricity implies that as economic … indicator of economic growth. This …",https://www.sciencedirect.com/science/article/pii/S0360544220314705,100,5,,Examining the linkages between electricity consumption and economic growth in African economies,12,84,economic growth,sciencedirect.com,ScienceDirect (Elsevier),/science/article/pii/S0360544220314705,{},,
htmlhtml nexus financial development economic growth across major asian economies evidence bootstrap ardl testing machine learning,"CF Wu, SC Huang, T Chang, CC Chiou",2020.0,"… other classifiers in prediction of economic status. The results … to foster economic growth, and 
economic growth is … thereby, robustly contribute to economic growth. The empirical analysis …",https://www.sciencedirect.com/science/article/pii/S037704271930665X,100,5,HTML,The nexus of financial development and economic growth across major Asian economies: Evidence from bootstrap ARDL testing and machine learning …,21,125,economic growth,sciencedirect.com,ScienceDirect (Elsevier),/science/article/pii/S037704271930665X,{},,
analyzing linkage military spending economic growth ecological footprint pakistan evidence cointegration bootstrap causality,"Z Ahmed, MW Zafar, S Mansoor",2020.0,"… such institutions can influence economic growth and the natural … economic growth and 
ecological footprint in Pakistan. The relationship between military spending and economic growth …",https://link.springer.com/article/10.1007/s11356-020-10076-9,98,1,,"Analyzing the linkage between military spending, economic growth, and ecological footprint in Pakistan: evidence from cointegration and bootstrap causality",19,137,economic growth,link.springer.com,Springer,/article/10.1007/s11356-020-10076-9,{},10.1007/s11356,
economic growth income inequality,S Kuznets,2019.0,"… Simon Kuznets to the American Economic Association in 1954. … of the traditional agricultural 
economy. The critically important … in the course of a country's economic growth? What factors …",https://www.taylorfrancis.com/chapters/edit/10.4324/9780429311208-4/economic-growth-income-inequality-simon-kuznets,22667,3,,Economic growth and income inequality,5,33,economic growth,taylorfrancis.com,Taylor & Francis,/chapters/edit/10.4324/9780429311208-4/economic-growth-income-inequality-simon-kuznets,{},10.4324/9780429311208,
reassessing projections world water development report,"A Boretti, L Rosa",2019.0,"… The aim of this paper is to highlight the inter-linkage in between population and economic 
growth and water demand, resources and pollution, that ultimately drive water scarcity, and …",https://www.nature.com/articles/s41545-019-0039-9,2241,7,,Reassessing the projections of the world water development report,9,57,economic growth,nature.com,Nature Publishing Group,/articles/s41545-019-0039-9,{},,
allocation talent us economic growth,"CT Hsieh, E Hurst, CI Jones, PJ Klenow",2019.0,"… -specific barriers to occupational choice can result in economic growth (changing τ's). To 
assess how much the changing τ's contributed to economic growth, we hold the τ's fixed while …",https://onlinelibrary.wiley.com/doi/abs/10.3982/ECTA11427,1429,3,,The allocation of talent and us economic growth,8,40,economic growth,onlinelibrary.wiley.com,Wiley Online Library,/doi/abs/10.3982/ECTA11427,{},10.3982/ECTA11427,
economic development international migration comparative perspective,DS Massey,2019.0,"… Economic growth depends not only on amounts of labor and capital, but also on institutional, 
cultural and technological factors that determine how labor and capital are used. I At the …",https://www.taylorfrancis.com/chapters/edit/10.4324/9780429045950-2/economic-development-international-migration-comparative-perspective-douglas-massey,1338,5,,Economic development and international migration in comparative perspective,8,68,economic growth,taylorfrancis.com,Taylor & Francis,/chapters/edit/10.4324/9780429045950-2/economic-development-international-migration-comparative-perspective-douglas-massey,{},10.4324/9780429045950,
toward sustainable environment nexus co2 emissions resource rent renewable nonrenewable energy 16eu countries,"FV Bekun, AA Alola, SA Sarkodie",2019.0,"… economic growth … economic growth, renewable, and nonrenewable energy consumption. 
We further observed a feedback causality between natural resources rent and economic growth…",https://www.sciencedirect.com/science/article/pii/S0048969718349477,1326,6,,"Toward a sustainable environment: Nexus between CO2 emissions, resource rent, renewable and nonrenewable energy in 16-EU countries",17,114,economic growth,sciencedirect.com,ScienceDirect (Elsevier),/science/article/pii/S0048969718349477,{},,
investigation environmental kuznets curve ecological footprint role energy financial development,"MA Destek, SA Sarkodie",2019.0,"… on the relationship between economic growth and pollution … to examine the effect of 
economic growth and other possible … the relationship between economic growth and ecological …",https://www.sciencedirect.com/science/article/pii/S0048969718338907,1085,8,,Investigation of environmental Kuznets curve for ecological footprint: the role of energy and financial development,15,101,economic growth,sciencedirect.com,ScienceDirect (Elsevier),/science/article/pii/S0048969718338907,{},,
vulnerable growth,"T Adrian, N Boyarchenko, D Giannone",2019.0,"We study the conditional distribution of GDP growth as a function of economic and financial 
conditions. Deteriorating financial conditions are associated with an increase in the …",https://www.aeaweb.org/articles?id=10.1257/aer.20161923,1036,3,,Vulnerable growth,2,16,economic growth,aeaweb.org,American Economic Association,/articles,{'id': ['10.1257/aer.20161923']},,
global warming increased global economic inequality,"NS Diffenbaugh, M Burke",2019.0,"… Here, we build on past work linking economic growth and … Finally, we use those counterfactual 
country-level economic … t, we compare economic growth under historical observed …",https://www.pnas.org/doi/abs/10.1073/pnas.1816020116,1011,9,,Global warming has increased global economic inequality,7,49,economic growth,pnas.org,Proceedings of the National Academy of Sciences,/doi/abs/10.1073/pnas.1816020116,{},,1816020116
impact renewable energy consumption financial development co2 emissions economic growth mena region panel vector autoregressive,"L Charfeddine, M Kahia",2019.0,"… also the impact of RE and FD on economic growth. … CO 2 emissions and economic growth. 
These results indicate that … economic growth. Several policies are proposed and discussed. …",https://www.sciencedirect.com/science/article/pii/S0960148119300102,988,6,,Impact of renewable energy consumption and financial development on CO2 emissions and economic growth in the MENA region: a panel vector autoregressive …,23,132,economic growth,sciencedirect.com,ScienceDirect (Elsevier),/science/article/pii/S0960148119300102,{},,
bookb world economic development 1979 beyond,H Kahn,2019.0,"… economic growth as a result of what are often called “social limits.” This is very different from 
drastically curbing growth … This book argues for rapid worldwide economic growth, for Third …",https://books.google.com/books?hl=en&lr=&id=Ml2yDwAAQBAJ&oi=fnd&pg=PP1&dq=economic+growth&ots=Ya4GtCkFtJ&sig=DAiuL5crohtFgaBz-jcp5cbAhsA,986,7,BOOK,World economic development: 1979 and beyond,6,38,economic growth,books.google.com,Google Books,/books,"{'hl': ['en'], 'id': ['Ml2yDwAAQBAJ'], 'oi': ['fnd'], 'pg': ['PP1'], 'dq': ['economic growth'], 'ots': ['Ya4GtCkFtJ'], 'sig': ['DAiuL5crohtFgaBz-jcp5cbAhsA']}",,
bookb economics population growth,JL Simon,2019.0,"… the effects of population change upon economic level and economic growth. That is, Part I 
… to which population growth has a positive feedback effect on economic growth and whether …",https://books.google.com/books?hl=en&lr=&id=jR-ODwAAQBAJ&oi=fnd&pg=PR14&dq=economic+growth&ots=3npmEBdd0S&sig=j5zm3svWcbT2PhVzIi4rrJGZ1FQ,882,3,BOOK,The economics of population growth,5,30,economic growth,books.google.com,Google Books,/books,"{'hl': ['en'], 'id': ['jR-ODwAAQBAJ'], 'oi': ['fnd'], 'pg': ['PR14'], 'dq': ['economic growth'], 'ots': ['3npmEBdd0S'], 'sig': ['j5zm3svWcbT2PhVzIi4rrJGZ1FQ']}",,
co2 emissions economic growth renewable nonrenewable energy production foreign trade china,"Y Chen, Z Wang, Z Zhong",2019.0,"… between exports, economic growth and carbon emissions in … emissions and economic growth, 
and economic growth is not the … that exist between economic growth, energy consumption, …",https://www.sciencedirect.com/science/article/pii/S0960148118308449,820,6,,"CO2 emissions, economic growth, renewable and non-renewable energy production and foreign trade in China",14,91,economic growth,sciencedirect.com,ScienceDirect (Elsevier),/science/article/pii/S0960148118308449,{},,
twentyfive years research institutions entrepreneurship economic growth learned,"D Urbano, S Aparicio, D Audretsch",2019.0,"… entrepreneurship and then entrepreneurship with economic growth. Finally, for the overall 
sequence, we combined all keywords from institutions to economic growth. In this last search, …",https://link.springer.com/article/10.1007/s11187-018-0038-0,815,3,,"Twenty-five years of research on institutions, entrepreneurship, and economic growth: what has been learned?",14,95,economic growth,link.springer.com,Springer,/article/10.1007/s11187-018-0038-0,{},10.1007/s11187,
htmlhtml dynamic impact trade policy economic growth fertility rate renewable nonrenewable energy consumption ecological footprint europe,"AA Alola, FV Bekun, SA Sarkodie",2019.0,"… how other explanatory variables like real economic growth, renewable energy consumption, 
… This is in line with the popular tradeoff between economic growth and environmental quality …",https://www.sciencedirect.com/science/article/pii/S0048969719321643,814,6,HTML,"Dynamic impact of trade policy, economic growth, fertility rate, renewable and non-renewable energy consumption on ecological footprint in Europe",19,127,economic growth,sciencedirect.com,ScienceDirect (Elsevier),/science/article/pii/S0048969719321643,{},,
bookb growth distribution,"DK Foley, TR Michl, D Tavani",2019.0,"… The focus of the book was then on explaining the slowdowns in economic growth that had … 
of economic growth was a preoccupation of the politically powerful. Economic growth confers …",https://books.google.com/books?hl=en&lr=&id=4fKBDwAAQBAJ&oi=fnd&pg=PP1&dq=economic+growth&ots=qpPklBE099&sig=3lPM1Xas6J8rNWwSTxJMU6nMiH0,792,3,BOOK,Growth and distribution,3,21,economic growth,books.google.com,Google Books,/books,"{'hl': ['en'], 'id': ['4fKBDwAAQBAJ'], 'oi': ['fnd'], 'pg': ['PP1'], 'dq': ['economic growth'], 'ots': ['qpPklBE099'], 'sig': ['3lPM1Xas6J8rNWwSTxJMU6nMiH0']}",,
dynamic linkages globalization financial development carbon emissions evidence asia pacific economic cooperation countries,"SAH Zaidi, MW Zafar, M Shahbaz, F Hou",2019.0,"… energy intensity and economic growth under the framework … carbon emissions, but economic 
growth and energy intensity … financial development causes economic growth but similar is …",https://www.sciencedirect.com/science/article/pii/S0959652619312971,756,1,,"Dynamic linkages between globalization, financial development and carbon emissions: evidence from Asia Pacific Economic Cooperation countries",16,126,economic growth,sciencedirect.com,ScienceDirect (Elsevier),/science/article/pii/S0959652619312971,{},,
impact natural resources human capital foreign direct investment ecological footprint case united states,"MW Zafar, SAH Zaidi, NR Khan, FM Mirza, F Hou",2019.0,"… of energy consumption and economic growth using US data from … Our findings suggest 
that economic growth and energy … footprint and between economic growth and the ecological …",https://www.sciencedirect.com/science/article/pii/S0301420719302132,756,2,,"The impact of natural resources, human capital, and foreign direct investment on the ecological footprint: the case of the United States",21,116,economic growth,sciencedirect.com,ScienceDirect (Elsevier),/science/article/pii/S0301420719302132,{},,
dynamic relationship among environmental regulation innovation co2 emissions population economic growth oecd countries panel investigation,"R Hashmi, K Alam",2019.0,"… Least Squares (PLS) Global level that economic growth has the greatest impact on CO 2 … 
OLS, FE, RE, FD, Generalized Methods of Moments (GMM) The impact of population growth …",https://www.sciencedirect.com/science/article/pii/S095965261931861X,735,7,,"Dynamic relationship among environmental regulation, innovation, CO2 emissions, population, and economic growth in OECD countries: A panel investigation",18,135,economic growth,sciencedirect.com,ScienceDirect (Elsevier),/science/article/pii/S095965261931861X,{},,
energy economic growth,DI Stern,2019.0,"… and some economic historians argue that increasing energy supply has been a principal 
driver of growth. On the other hand, most mainstream economic growth theories ignore the role …",https://www.taylorfrancis.com/chapters/edit/10.4324/9781315459653-3/energy-economic-growth-david-stern,729,6,,Energy and economic growth,4,23,economic growth,taylorfrancis.com,Taylor & Francis,/chapters/edit/10.4324/9781315459653-3/energy-economic-growth-david-stern,{},10.4324/9781315459653,
contradiction sustainable development goals growth versus ecology finite planet,J Hickel,2019.0,"… The other calls for continued global economic growth equivalent to 3% per year, as outlined 
in Goal 8, as a method for achieving human development objectives. The SDGs assume that …",https://onlinelibrary.wiley.com/doi/abs/10.1002/sd.1947,691,7,,The contradiction of the sustainable development goals: Growth versus ecology on a finite planet,14,83,economic growth,onlinelibrary.wiley.com,Wiley Online Library,/doi/abs/10.1002/sd.1947,{},,1947
credit growth crowd real economic growth,"SG Cecchetti, E Kharroubi",2019.0,"… Why Does Credit Growth Crowd Out Real Economic Growth? … we examine growth in 
real GDP per person employed versus growth in real credit to the private sector. Our sample …",https://onlinelibrary.wiley.com/doi/abs/10.1111/manc.12295,677,3,,Why does credit growth crowd out real economic growth?,9,46,economic growth,onlinelibrary.wiley.com,Wiley Online Library,/doi/abs/10.1111/manc.12295,{},,12295
carbon dioxide co2 emissions economic growth systematic review two decades research 1995 2017,"A Mardani, D Streimikiene, F Cavallaro",2019.0,"… The outcomes of this article revealed that, economic growth increased CO 2 emissions in 
some countries like, Qatar, Saudi Arabia. Bahrain and Oman, also financial development was …",https://www.sciencedirect.com/science/article/pii/S0048969718331930,667,6,,Carbon dioxide (CO2) emissions and economic growth: A systematic review of two decades of research from 1995 to 2017,19,98,economic growth,sciencedirect.com,ScienceDirect (Elsevier),/science/article/pii/S0048969718331930,{},,
entrepreneurial university driver economic growth social changekey strategic challenges,"M Klofsten, A Fayolle, M Guerrero, S Mian",2019.0,"… The strategic role that universities could have as drivers of regional economic growth 
Mixed-methods approach based on quantitative SNA (network relationship indexes) and in-depth …",https://www.sciencedirect.com/science/article/pii/S0040162518319176,664,4,,The entrepreneurial university as driver for economic growth and social change-Key strategic challenges,13,91,economic growth,sciencedirect.com,ScienceDirect (Elsevier),/science/article/pii/S0040162518319176,{},,
role financial development economic growth foreign direct investment driving climate change case emerging asean,"MA Nasir, TLD Huynh, HTX Tram",2019.0,"… In the context of remarkable economic growth and financial … (CO2 emission) of economic 
growth, foreign direct investment … Our findings indicate that financial and economic development…",https://www.sciencedirect.com/science/article/pii/S0301479719304256,630,2,,"Role of financial development, economic growth & foreign direct investment in driving climate change: A case of emerging ASEAN",19,108,economic growth,sciencedirect.com,ScienceDirect (Elsevier),/science/article/pii/S0301479719304256,{},,
fossil fuels foreign direct investment economic growth triggered co2 emissions emerging asian economies empirical evidence,"I Hanif, SMF Raza, P Gago",2019.0,"… direct investment and economic growth on carbon emissions in … , the efforts to foster 
economic growth are contributing to the … an environmentally friendly economic growth strategy in …",https://www.sciencedirect.com/science/article/pii/S0360544219300131,629,2,,"Fossil fuels, foreign direct investment, and economic growth have triggered CO2 emissions in emerging Asian economies: some empirical evidence",19,124,economic growth,sciencedirect.com,ScienceDirect (Elsevier),/science/article/pii/S0360544219300131,{},,
impact globalization economic factors energy consumption co2 emissions pakistan,"MK Khan, JZ Teng, MI Khan, MO Khan",2019.0,"… trade openness, financial development, economic development and environmental quality 
… economic growth through foreign trade and investment, attaining highest economic growth …",https://www.sciencedirect.com/science/article/pii/S0048969719326336,606,1,,"Impact of globalization, economic factors and energy consumption on CO2 emissions in Pakistan",13,81,economic growth,sciencedirect.com,ScienceDirect (Elsevier),/science/article/pii/S0048969719326336,{},,
urbanization economic growth environmental pollution evidence china,"W Liang, M Yang",2019.0,"… economic growth model” and a “simultaneous equation model.” The results show that 
urbanization promotes economic growth … relationship between economic growth and urbanization …",https://www.sciencedirect.com/science/article/pii/S2210537918301598,580,8,,"Urbanization, economic growth and environmental pollution: Evidence from China",9,70,economic growth,sciencedirect.com,ScienceDirect (Elsevier),/science/article/pii/S2210537918301598,{},,
linking economic growth ecological footprint human capital biocapacity,"ST Hassan, MA Baloch, N Mahmood",2019.0,"… This study examines the relationship between economic growth … to reveal that economic 
growth increases ecological footprint … between economic growth and the ecological footprint. …",https://www.sciencedirect.com/science/article/pii/S2210670719300459,576,3,,Linking economic growth and ecological footprint through human capital and biocapacity,11,76,economic growth,sciencedirect.com,ScienceDirect (Elsevier),/science/article/pii/S2210670719300459,{},,
nonrenewable renewable energy impact economic growth role research development expenditures asiapacific economic cooperation,"MW Zafar, M Shahbaz, F Hou, A Sinha",2019.0,"… in economic growth. Research and development expenditures and trade openness have a 
positive effect on economic growth. … a positive impact on economic growth. The heterogenous …",https://www.sciencedirect.com/science/article/pii/S0959652618337892,572,6,,From nonrenewable to renewable energy and its impact on economic growth: the role of research & development expenditures in Asia-Pacific Economic Cooperation …,23,138,economic growth,sciencedirect.com,ScienceDirect (Elsevier),/science/article/pii/S0959652618337892,{},,
circular economy swings roundabouts,"N Millar, E McLaughlin, T Börger",2019.0,"… whilst addressing the issues of environmental deterioration, social equity and long-term 
economic growth with the explicit suggestion that it can serve as a tool for Sustainable …",https://www.sciencedirect.com/science/article/pii/S092180091830538X,562,6,,The circular economy: swings and roundabouts?,6,40,economic growth,sciencedirect.com,ScienceDirect (Elsevier),/science/article/pii/S092180091830538X,{},,
economic growth natural resources ecological footprints evidence pakistan,"ST Hassan, E Xia, NH Khan, SMA Shah",2019.0,"… This study estimates the impact of economic growth and natural resources on Pakistan’s 
ecological footprint using an autoregressive distributive lag (ARDL) model for long-run …",https://link.springer.com/article/10.1007/S11356-018-3803-3,544,1,,"Economic growth, natural resources, and ecological footprints: evidence from Pakistan",10,76,economic growth,link.springer.com,Springer,/article/10.1007/S11356-018-3803-3,{},10.1007/S11356,
contribution sustainable tourism economic growth employment pakistan,"F Manzoor, L Wei, M Asif, MZ Haq",2019.0,"… economic development and GDP growth. This study investigates the impact of tourism on 
Pakistan’s economic growth … of tourism on Pakistan’s economic growth as well as employment …",https://www.mdpi.com/1660-4601/16/19/3785,543,1,,The contribution of sustainable tourism to economic growth and employment in Pakistan,12,74,economic growth,mdpi.com,MDPI (Multidisciplinary Digital Publishing Institute),/1660-4601/16/19/3785,{},,
corruption economic growth new empirical evidence,"K Gründler, N Potrafke",2019.0,"… influence economic growth. The “grease the wheels” hypothesis holds that corruption increases 
economic growth … is likely to give rise to vibrant economic activity. The “sand the wheels” …",https://www.sciencedirect.com/science/article/pii/S0176268019301156,533,1,,Corruption and economic growth: New empirical evidence,7,48,economic growth,sciencedirect.com,ScienceDirect (Elsevier),/science/article/pii/S0176268019301156,{},,
productservicesystems circular economy route decoupling economic growth resource consumption,"LL Kjaer, DCA Pigosso, M Niero",2019.0,"… a circular economy (CE), in which economic growth is decoupled from … lead to decoupling 
economic growth from resource … , irrespective of the growth rate of the economic driver. In this …",https://onlinelibrary.wiley.com/doi/abs/10.1111/jiec.12747,530,6,,Product/service‐systems for a circular economy: the route to decoupling economic growth from resource consumption?,14,101,economic growth,onlinelibrary.wiley.com,Wiley Online Library,/doi/abs/10.1111/jiec.12747,{},,12747
another look relationship energy consumption carbon dioxide emissions economic growth south africa,"FV Bekun, F Emir, SA Sarkodie",2019.0,"… and economic growth nexus … to economic growth, validating the energy-led growth hypothesis. 
Our study found an inverted U-shaped pattern between energy use and economic growth …",https://www.sciencedirect.com/science/article/pii/S004896971834628X,518,6,,"Another look at the relationship between energy consumption, carbon dioxide emissions, and economic growth in South Africa",17,106,economic growth,sciencedirect.com,ScienceDirect (Elsevier),/science/article/pii/S004896971834628X,{},,
impact information communication technology economic growth evidence developing countries,"R Bahrini, AA Qaffas",2019.0,"… economic growth in these regions. Given this, the purpose of this paper is to investigate the 
effect of ICT diffusion on the economic growth … Moment (GMM) growth model over the period …",https://www.mdpi.com/2227-7099/7/1/21,517,1,,Impact of information and communication technology on economic growth: Evidence from developing countries,13,93,economic growth,mdpi.com,MDPI (Multidisciplinary Digital Publishing Institute),/2227-7099/7/1/21,{},,
